{
  "$schema": "https://json-schema.org/draft/2020-12/schema",
  "$id": "question.schema.json",
  "title": "Mock exam question file",
  "description": "A question file is a JSON array of items. Every item carries its correct answer and a reason for every option, so the platform can explain why each choice is right or wrong.",
  "type": "array",
  "items": {
    "type": "object",
    "required": ["id", "domain", "skill", "difficulty", "type", "select", "stem", "options", "explanation"],
    "additionalProperties": false,
    "properties": {
      "id": { "type": "string", "pattern": "^[A-Z0-9-]+$", "description": "Unique id, e.g. D2-API-001 (domain, skill code, number)." },
      "domain": { "type": "integer", "minimum": 1, "description": "Domain id from exam.json." },
      "skill": { "type": "string", "description": "Skill id from exam.json; must belong to `domain`." },
      "difficulty": { "enum": [1, 2, 3, 4], "description": "1 Foundational (apply a single concept in a scenario), 2 Intermediate (applied scenario), 3 Advanced (multi-constraint tradeoff or diagnosis), 4 Expert (several defensible options; only one satisfies every stated constraint)." },
      "type": { "enum": ["single", "multi"], "description": "single = multiple choice (4 options, 1 key); multi = multiple response (5–6 options, 2–3 keys)." },
      "select": { "type": "integer", "minimum": 1, "maximum": 3, "description": "How many options the candidate must select; equals the number of correct options." },
      "stem": { "type": "string", "minLength": 20, "description": "The scenario and question. Multi-response stems end with \"(Choose two.)\" or \"(Choose three.)\". Supports `inline code` and ``` fenced blocks." },
      "options": {
        "type": "array",
        "minItems": 4,
        "maxItems": 6,
        "items": {
          "type": "object",
          "required": ["id", "text", "correct", "why"],
          "additionalProperties": false,
          "properties": {
            "id": { "type": "string", "pattern": "^[A-F]$" },
            "text": { "type": "string", "minLength": 1 },
            "correct": { "type": "boolean" },
            "why": { "type": "string", "minLength": 10, "description": "Why this specific option is right or wrong. Shown to the candidate on review." }
          }
        }
      },
      "explanation": { "type": "string", "minLength": 20, "description": "The overall teaching point for the item." },
      "reference": { "type": "string", "description": "Official documentation page that backs the answer." },
      "source": { "type": "string", "description": "Provenance, e.g. 'Official Exam Guide sample 1'." },
      "roleLevel": { "enum": [1, 2, 3, 4, 5], "description": "Role the question is pitched at: 1 Fresher (0–1 yrs), 2 Junior/SDE-1 (1–3), 3 Mid/SDE-2 (3–5), 4 Senior/SDE-3 (5–8), 5 Staff/Lead (8+)." },
      "asked": {
        "type": "object",
        "description": "Present when the question, or the interview question it tests, is reported as asked in real interviews.",
        "required": ["frequency", "evidence"],
        "additionalProperties": false,
        "properties": {
          "frequency": { "enum": ["very-common", "common", "occasional"], "description": "very-common: 3+ independent sources; common: 2; occasional: 1." },
          "evidence": { "type": "array", "minItems": 1, "maxItems": 5, "items": { "type": "string", "pattern": "^https?://" }, "description": "Public sources: interview-experience posts first, then curated lists." },
          "companies": { "type": "array", "items": { "type": "string" }, "description": "Companies named by the sources." }
        }
      }
    }
  }
}
