[
  {
    "id": "RCT-IQ4-PRF-001",
    "domain": 3,
    "skill": "performance",
    "difficulty": 2,
    "roleLevel": 3,
    "type": "multi",
    "select": 2,
    "stem": "A product listing page (a client-rendered React SPA) takes about 6 seconds to show its hero on a mid-range phone. Lighthouse reports LCP at 5.8 s. The single JavaScript bundle is 1.9 MB, and the LCP element is a 2400 px wide JPEG hero marked `loading=\"lazy\"`. Which two changes go after the biggest costs first? (Choose two.)",
    "options": [
      {
        "id": "A",
        "text": "Drop `loading=\"lazy\"` from the above-the-fold hero, serve it at the rendered size in a modern format with `srcset`, and consider `fetchpriority=\"high\"`",
        "correct": true,
        "why": "Lazy-loading the LCP image delays its request, and a 2400 px JPEG on a phone wastes bytes. Both push LCP out directly."
      },
      {
        "id": "B",
        "text": "Run a bundle analyser, split the code by route with dynamic `import()` / `React.lazy`, and replace or trim the heaviest dependencies",
        "correct": true,
        "why": "A client-rendered page cannot paint content until its JavaScript downloads, parses and runs, so a 1.9 MB bundle is on the critical path."
      },
      {
        "id": "C",
        "text": "Wrap every component in `React.memo` so the page renders fewer times during load",
        "correct": false,
        "why": "Memoisation reduces re-render work after load. The first render still happens, and none of the download cost changes."
      },
      {
        "id": "D",
        "text": "Add `loading=\"lazy\"` to every image on the page, including the hero, so fewer bytes compete with the bundle",
        "correct": false,
        "why": "Lazy-loading the hero is part of the problem: the browser waits for layout before it even starts fetching the LCP image."
      },
      {
        "id": "E",
        "text": "Swap the data-fetching `useEffect` calls for `useLayoutEffect` so data arrives before the first paint",
        "correct": false,
        "why": "Layout effects block paint; they do not make the network faster. The page would paint later, not sooner."
      }
    ],
    "explanation": "Interviewers who ask \"the page is slow, how do you debug it?\" want a measured order of attack: look at the Network panel and Lighthouse, find the LCP element, and see what is on the critical path. For a client-rendered app that is usually the JavaScript bundle (fix with analysis, route-level splitting and lighter dependencies) and the hero image (correct size, modern format, no lazy loading above the fold, higher fetch priority). A CDN with good cache headers helps both. Re-render tuning such as `memo` comes later because it does not touch load cost.",
    "reference": "web.dev: Optimize Largest Contentful Paint; react.dev: lazy",
    "asked": {
      "frequency": "very-common",
      "evidence": [
        "https://www.geeksforgeeks.org/interview-experiences/ez-works-frontend-developer-interview-experience-rounds-1-2/",
        "https://raw.githubusercontent.com/saumyadip25/Frontend-Interview-Experiences/HEAD/Scispace.md",
        "https://raw.githubusercontent.com/saumyadip25/Frontend-Interview-Experiences/HEAD/eBay.md",
        "https://roundz.substack.com/p/flipkart-interview-experience-frontend-engineer-sde2",
        "https://www.geeksforgeeks.org/interview-experiences/vmock-interview-experience-for-senior-reactjs-frontend-engineer-3-5-years-experienced/"
      ],
      "companies": [
        "EZ Works",
        "SciSpace",
        "eBay",
        "Flipkart",
        "Vmock",
        "OpenEnvoy",
        "ServiceNow"
      ]
    },
    "source": "interview:rx-page-load-performance"
  },
  {
    "id": "RCT-IQ4-PRF-002",
    "domain": 3,
    "skill": "performance",
    "difficulty": 2,
    "roleLevel": 3,
    "type": "single",
    "select": 1,
    "stem": "On a landing page, the hero image is the largest element in the viewport. A CDN misconfiguration makes that image arrive 3 seconds later than before. The text, layout and the hero's reserved box (fixed `width` and `height`) still appear on time, and the page responds to taps as before. Which Core Web Vital gets noticeably worse?",
    "options": [
      {
        "id": "A",
        "text": "Cumulative Layout Shift (CLS)",
        "correct": false,
        "why": "The hero box already has reserved dimensions, so nothing moves when the image finally arrives."
      },
      {
        "id": "B",
        "text": "Largest Contentful Paint (LCP)",
        "correct": true,
        "why": "LCP is the time at which the largest image or text block in the viewport is rendered, so a late hero image delays it directly."
      },
      {
        "id": "C",
        "text": "Interaction to Next Paint (INP)",
        "correct": false,
        "why": "INP measures how quickly the page responds to user input, and the stem says taps respond as before."
      },
      {
        "id": "D",
        "text": "Time to First Byte (TTFB)",
        "correct": false,
        "why": "TTFB measures the response for the HTML document itself, not for images loaded afterwards."
      }
    ],
    "explanation": "Each Core Web Vital measures one thing. LCP is loading: when the largest content element paints. CLS is visual stability: how much content jumps. INP is responsiveness to input. A late hero image hits LCP. If the image had no reserved size it would also cause CLS when it popped in, which is why interviewers often follow up with \"and how do you stop the jump?\" (set dimensions or `aspect-ratio`).",
    "reference": "web.dev: Largest Contentful Paint (LCP)",
    "asked": {
      "frequency": "very-common",
      "evidence": [
        "https://www.geeksforgeeks.org/interview-experiences/ez-works-frontend-developer-interview-experience-rounds-1-2/",
        "https://raw.githubusercontent.com/saumyadip25/Frontend-Interview-Experiences/HEAD/Scispace.md",
        "https://raw.githubusercontent.com/saumyadip25/Frontend-Interview-Experiences/HEAD/eBay.md",
        "https://roundz.substack.com/p/flipkart-interview-experience-frontend-engineer-sde2",
        "https://www.geeksforgeeks.org/interview-experiences/vmock-interview-experience-for-senior-reactjs-frontend-engineer-3-5-years-experienced/"
      ],
      "companies": [
        "EZ Works",
        "SciSpace",
        "eBay",
        "Flipkart",
        "Vmock",
        "OpenEnvoy",
        "ServiceNow"
      ]
    },
    "source": "interview:rx-page-load-performance"
  },
  {
    "id": "RCT-IQ4-RSC-001",
    "domain": 4,
    "skill": "server-components",
    "difficulty": 3,
    "roleLevel": 3,
    "type": "single",
    "select": 1,
    "stem": "You are choosing a rendering strategy for three parts of one product:\n\n1. A logged-in analytics dashboard with per-user data, no SEO needs, refreshed by polling.\n2. Product pages that must rank in search, with prices and stock that change several times an hour.\n3. A marketing blog whose posts rarely change after publishing.\n\nWhich assignment fits best?",
    "options": [
      {
        "id": "A",
        "text": "Dashboard: SSG. Product pages: CSR. Blog: SSR on every request",
        "correct": false,
        "why": "Per-user dashboard data cannot be built once at deploy time, and client-only product pages weaken first paint and SEO, the two things those pages need."
      },
      {
        "id": "B",
        "text": "Dashboard: SSR. Product pages: SSG built once per deploy. Blog: CSR",
        "correct": false,
        "why": "Product prices would stay stale until the next deploy, and a client-rendered blog gives up SEO for content that is easy to pre-render."
      },
      {
        "id": "C",
        "text": "Dashboard: CSR. Product pages: SSR or ISR. Blog: SSG",
        "correct": true,
        "why": "Each part gets what it needs: rich client interactivity behind login, fresh and crawlable product HTML, and cheap pre-built pages for static posts."
      },
      {
        "id": "D",
        "text": "Everything SSG, with a client-side refetch on mount to update stale data",
        "correct": false,
        "why": "A build cannot produce per-user dashboards, and pages that show stale prices until JavaScript runs give crawlers and first paint the wrong data."
      }
    ],
    "explanation": "The interviewer wants to hear the trade-offs, not a favourite. CSR suits private, highly interactive screens where SEO does not matter. SSR builds HTML per request, so content is fresh and crawlable at the cost of server work on every hit. SSG builds HTML once and serves it from a CDN, which is ideal for content that rarely changes. ISR sits between them: static pages that regenerate after a time window or on demand. Most real apps mix all of these per route.",
    "reference": "Next.js docs: Incremental Static Regeneration (ISR)",
    "asked": {
      "frequency": "very-common",
      "evidence": [
        "https://www.geeksforgeeks.org/interview-experiences/ez-works-frontend-developer-interview-experience-rounds-1-2/",
        "https://raw.githubusercontent.com/saumyadip25/Frontend-Interview-Experiences/HEAD/Scispace.md",
        "https://raw.githubusercontent.com/saumyadip25/Frontend-Interview-Experiences/HEAD/Salesforce.md",
        "https://learnersbucket.com/interview/reliance-jio-interview-experience/",
        "https://leetcode.com/discuss/post/5807891/meesho-frontend-dev-1-bangalore-sept-2024-rejected"
      ],
      "companies": [
        "EZ Works",
        "SciSpace",
        "Salesforce",
        "Reliance Jio",
        "Meesho",
        "Zomato"
      ]
    },
    "source": "interview:rx-csr-ssr-ssg"
  },
  {
    "id": "RCT-IQ4-RSC-002",
    "domain": 4,
    "skill": "server-components",
    "difficulty": 3,
    "roleLevel": 3,
    "type": "multi",
    "select": 2,